{
  "run_id": "20260706-0307-sdlc-toy-cli",
  "workflow": {
    "id": "sdlc",
    "lock": "workflow.lock.yaml"
  },
  "status": "complete",
  "created_at": "2026-07-06T03:07:45Z",
  "updated_at": "2026-07-06T03:55:10Z",
  "classification": {
    "work_type": "new-feature",
    "risk": "low",
    "gates_applied": [
      "requirements",
      "architecture",
      "release"
    ],
    "assumptions": [
      "The 'repo' is this harness repo itself; examples/toy-cli/ is a new directory.",
      "No production impact: this is a toy verification exercise for the harness."
    ],
    "approval": {
      "required": false,
      "granted_at": null
    }
  },
  "current_stage": null,
  "stages": {
    "intake": {
      "status": "passed",
      "attempts": 1,
      "artifacts": {
        "requirements": "stages/intake/artifacts/requirements.md"
      },
      "summary": "stages/intake/summary.md"
    },
    "design": {
      "status": "passed",
      "attempts": 1,
      "artifacts": {
        "design_doc": "stages/design/artifacts/design.md",
        "decisions": "stages/design/artifacts/decisions.json"
      },
      "summary": "stages/design/summary.md"
    },
    "plan": {
      "status": "passed",
      "attempts": 1,
      "artifacts": {
        "implementation_plan": "stages/plan/artifacts/plan.md"
      },
      "summary": "stages/plan/summary.md"
    },
    "implement": {
      "status": "passed",
      "attempts": 1,
      "artifacts": {
        "change_summary": "stages/implement/artifacts/change_summary.md",
        "diff_manifest": "stages/implement/artifacts/diff_manifest.json"
      },
      "summary": "stages/implement/summary.md"
    },
    "verify": {
      "status": "passed",
      "attempts": 1,
      "artifacts": {
        "verification_report": "stages/verify/artifacts/verification_report.md"
      },
      "summary": "stages/verify/summary.md"
    },
    "deliver": {
      "status": "passed",
      "attempts": 2,
      "artifacts": {
        "delivery_package": "stages/deliver/artifacts/delivery.md"
      },
      "summary": "stages/deliver/summary.md"
    }
  }
}